{
  "family": "jangdan_kultrun",
  "name": "Jangdan coreano y kultrún mapuche",
  "notes": "Del jangdan se conocen longitudes y agrupamientos, no los golpes: se cargan los inicios de gak o de pulso como estructura editable. El kultrún queda fuera de la lista pública (restricted_use) y solo aporta un principio estructural.",
  "patterns": [
    {
      "id": "CIC.4.5/jinyangjo", "name": "Jinyangjo (24)",
      "taxonomy": ["CIC.4.5", "FOR.2.2"],
      "origin": { "tradition": "Corea", "genre": ["pansori", "sanjo"], "context": "el jangdan más lento; 6 pulsos por gak, 4 gak", "sources": ["Wikipedia: Traditional Korean rhythm"] },
      "status": "H", "verify": true, "missing_data": true, "verify_notes": "Golpes del janggu por verificar; se marcan los inicios de gak.",
      "cycle_len": 24, "step_value": 1, "meter": "24/4", "grouping": [6, 6, 6, 6],
      "layers": [ { "role": "gak", "onsets": [0, 6, 12, 18], "timbre": [2, 0, 0, 1] } ],
      "transforms_allowed": ["density"],
      "destinations": ["ethnic", "others"], "categories": ["world_cycles"],
      "tags": ["korea", "jangdan"], "bpm_range": [20, 60],
      "repeat_policy": { "mode": "cycles", "default_repeats": 2, "variation_on_last": "none" }
    },
    {
      "id": "CIC.4.5/jungmori", "name": "Jungmori (12)",
      "taxonomy": ["CIC.4.5"],
      "origin": { "tradition": "Corea", "genre": ["pansori", "minyo"], "context": "jangdan medio de 12 pulsos", "sources": ["Wikipedia: Traditional Korean rhythm"] },
      "status": "H", "verify": true, "missing_data": true, "verify_notes": "Golpes por verificar; se marca el ciclo.",
      "cycle_len": 12, "step_value": 1, "meter": "12/4",
      "layers": [ { "role": "beat", "onsets": [0], "timbre": [2] } ],
      "transforms_allowed": ["density"],
      "destinations": ["ethnic", "others"], "categories": ["world_cycles"],
      "tags": ["korea", "jangdan"], "bpm_range": [60, 120],
      "repeat_policy": { "mode": "cycles", "default_repeats": 4, "variation_on_last": "none" }
    },
    {
      "id": "CIC.4.5/semachi", "name": "Semachi (3 pulsos ternarios)",
      "taxonomy": ["CIC.4.5", "MET.2.4"],
      "origin": { "tradition": "Corea", "genre": ["minyo"], "context": "algo rápido, de tres pulsos", "sources": ["Wikipedia: Traditional Korean rhythm"] },
      "status": "H", "verify": true, "missing_data": true, "verify_notes": "Subdivisión y golpes por verificar.",
      "cycle_len": 3, "step_value": 1, "meter": "3/4",
      "layers": [ { "role": "beat", "onsets": [0], "timbre": [2] } ],
      "transforms_allowed": ["density"],
      "destinations": ["ethnic", "others"], "categories": ["world_cycles"],
      "tags": ["korea", "jangdan"],
      "repeat_policy": { "mode": "cycles", "default_repeats": 8, "variation_on_last": "none" }
    },
    {
      "id": "CIC.4.5/eotmori", "name": "Eotmori (10/8)",
      "taxonomy": ["CIC.4.5", "MET.3.2"],
      "origin": { "tradition": "Corea", "genre": ["pansori", "sanjo"], "context": "jangdan muy rápido en 10/8", "sources": ["Wikipedia: Traditional Korean rhythm"] },
      "status": "H", "verify": true, "verify_notes": "Agrupamiento 3+3+2+2 o 3+2+2+3 según escuela; se carga 3+3+2+2 editable.",
      "cycle_len": 10, "step_value": 0.5, "meter": "10/8", "grouping": [3, 3, 2, 2],
      "layers": [ { "role": "group", "onsets": [0, 3, 6, 8], "timbre": [2, 1, 0, 1] } ],
      "params": { "grouping_alternatives": [[3, 3, 2, 2], [3, 2, 2, 3]] },
      "transforms_allowed": ["density", "rotate"],
      "destinations": ["ethnic", "others", "arpeggio"], "categories": ["world_cycles"],
      "tags": ["korea", "jangdan", "10/8"], "bpm_range": [150, 240],
      "repeat_policy": { "mode": "cycles", "default_repeats": 8, "variation_on_last": "none" }
    },
    {
      "id": "CIC.4.5/jajinmori", "name": "Jajinmori (4 pulsos ternarios)",
      "taxonomy": ["CIC.4.5", "MET.2.4"],
      "origin": { "tradition": "Corea", "genre": ["pansori", "sanjo"], "context": "rápido, equivalente a 12/8", "sources": ["Wikipedia: Traditional Korean rhythm"] },
      "status": "H", "verify": true, "missing_data": true, "verify_notes": "Golpes por verificar; se marcan los cuatro pulsos.",
      "cycle_len": 12, "step_value": 0.333333, "meter": "12/8", "grouping": [3, 3, 3, 3],
      "layers": [ { "role": "beat", "onsets": [0, 3, 6, 9], "timbre": [2, 0, 0, 1] } ],
      "transforms_allowed": ["density"],
      "destinations": ["ethnic", "others", "arpeggio"], "categories": ["world_cycles"],
      "tags": ["korea", "jangdan", "12/8"], "bpm_range": [100, 180],
      "repeat_policy": { "mode": "cycles", "default_repeats": 8, "variation_on_last": "none" }
    },
    {
      "id": "CIC.9/kultrun_principio", "name": "Kultrún (principio de ciclo de cuatro)",
      "taxonomy": ["CIC.9"],
      "origin": { "tradition": "Mapuche (Chile y Argentina)", "genre": ["ülkantun", "purrun"], "context": "instrumento ceremonial de la machi; su membrana representa el universo dividido en cuatro", "sources": ["Grebe 1973, Revista Musical Chilena", "Memoria Chilena"], "restricted_use": true },
      "status": "H", "verify": true, "restricted_use": true, "structural_only": true, "missing_data": true,
      "cultural_note": "El kultrún es un instrumento ceremonial de la machi. Este principio (ciclo de cuatro, golpe y sacudida) no reproduce toques ceremoniales; su uso como repertorio requiere el consentimiento de las comunidades y especialistas que lo sostienen.",
      "verify_notes": "Las transcripciones de 1934–1949 citadas por Grebe no se consultaron.",
      "cycle_len": 4, "step_value": 1, "meter": "4/4",
      "layers": [ { "role": "golpe", "onsets": [0, 1, 2, 3], "timbre": [0, 0, 0, 0] }, { "role": "sacudida", "onsets": [0, 2], "timbre": [3, 3] } ],
      "transforms_allowed": [],
      "destinations": ["ethnic"], "categories": ["world_cycles"],
      "tags": ["ritual"],
      "repeat_policy": { "mode": "cycles", "default_repeats": 4, "variation_on_last": "none" }
    }
  ]
}
